코스피, 3070선 하락 마감… 외국인 3300억원 '셀코리아',코스피가 외국인 매도세에 3070선에서 마감했다. 2일 한국거래소에 따르면 이날 코스피는 전 거래일 대비 14.59포인트(0.4 …,https://n.news.naver.com/mnews/article/417/0001086906?sid=101
창원 액화수소플랜트 상업운전 개시…시 재정부담 우려 현실화,하루 5t 구매확약했지만 수요처 없어…연간 300억원 부담 위기 경남 창원에 들어선 국내 첫 액화수소플랜트가 준공된 지 2년이 …,https://n.news.naver.com/mnews/article/001/0015483907?sid=101
‘창립 30주년’ 신세계푸드, 기념식 대신 현장경영 집중,신세계푸드가 창립 30주년을 맞아 기념식 대신 안전한 작업 환경 조성을 위한 현장 경영에 나섰다고 2일 밝혔다. 강승협 신세계푸 …,https://n.news.naver.com/mnews/article/020/0003645289?sid=101
코스피 외인 매도 속 3,070대 약세 마감,2일 서울 중구 하나은행 본점 딜링룸 현황판에 코스피 지수가 표시돼 있다. 이날 코스피 지수 종가는 전 거래일 대비 14.59포 …,https://n.news.naver.com/mnews/article/001/0015483904?sid=101
폭염에 입맛 없다면···냉면·비빔면·막국수·메밀소바, 간편하게 먹는 면류 총출동,연일 푹푹찌는 무더위에 열대아가 이어지는 가운데 국가대표 식품강자들이 여름 면류 경쟁이 본격 나서고 있다. 고물가시대 외식가격이 …,https://n.news.naver.com/mnews/article/032/0003380112?sid=101
신형 '볼보 XC90·S90' 보니...유튜브·인스타그램 사용 가능[카미경],이제 볼보자동차만 타면 지겹다는 편견이 사라질 것 같다. 11.2인치 크기의 XC90과 S90 디스플레이에 유튜브 뿐만 아니라 …,https://n.news.naver.com/mnews/article/293/0000069346?sid=101
코스피 외인 매도 속 3,070대 약세 마감…코스닥도 내려,▲ 2일 서울 중구 하나은행 본점에서 직원들이 증시와 환율을 모니터하고 있다. 코스피가 외국인의 순매도세에 밀려 3거래일 만에 …,https://n.news.naver.com/mnews/article/055/0001271665?sid=101
한발 물러선 태광산업…"교환사채 발행 중단",자사주로 교환사채(EB) 발행에 나섰던 태광산업이 후속 절차를 중단하기로 했다. 태광산업은 2일 공식 입장문을 내고 "트러스톤 …,https://n.news.naver.com/mnews/article/215/0001214864?sid=101
머스크·공화당 일부, 왜 '트럼프 감세안' 반대하나,도널드 트럼프 대통령의 주요 국정 의제를 반영한 이른바 하나의 크고 아름다운 법안(OBBB)이 1일(현지시간) 미 상원 본회의에 …,https://n.news.naver.com/mnews/article/018/0006054846?sid=101
'영끌족' 틀어막기 본격화... 카드론 신용대출 분류 규제 강화한다,정부가 가계부채 관리를 강화하기 위해 신용대출 한도를 연 소득 100% 이내로 제한한 가운데, 금융당국이 카드사의 카드론도 신용 …,https://n.news.naver.com/mnews/article/123/0002362847?sid=101
5월 호주 소매매출 0.2%↑ '둔화'…"추가 금리인하 가능성",호주 체감경기를 보여주는 2025년 5월 소매 매출액(계절조정치)은 전월 대비 0.2% 늘었다고 ABC 방송과 AAP 통신, 인 …,https://n.news.naver.com/mnews/article/003/0013339237?sid=101
국정위 주도 첫 입법은 'R&D 투자 국가 총지출 5% 이상 권장',국정기획위원회가 연구개발(R&D) 예산 비율을 '국가 총지출의 5% 이상'으로 권장하는 내용을 담은 법안을 발의했다. 국가과학기 …,https://n.news.naver.com/mnews/article/014/0005371506?sid=101
'단돈 32원' 시리얼 컵 대란 결말은?…"주문 3만여 건 취소",쿠팡은 시리얼 컵 가격 노출 오류로 발생한 주문 3만 여건을 모두 취소 처리했다고 오늘(2일) 밝혔습니다. 이는 지난달 30일 …,https://n.news.naver.com/mnews/article/422/0000755460?sid=101
파월 7월 금리 인하 불가 한 발 물러섰지만 시장은?,제롬 파월 연방준비제도(Fed 연준) 의장이 7월 금리 인하와 관련해 기존 입장에서 한 발 물러났다. 최근까지도 9월까지는 기다 …,https://n.news.naver.com/mnews/article/014/0005371505?sid=101
공정위, 대구염색산단 입찰 담합 효성·LS에 시정 명령,공정거래위원회는 대구염색산업단지 발전소 공사 입찰에서 담합한 효성중공업(효성)과 LS일렉트릭(LS)에 시정 명령과 함께 과징금 …,https://n.news.naver.com/mnews/article/657/0000040133?sid=101
부산은행, '스테이블코인' 연구 박차…OBDIA에 정식 가입,BNK부산은행이 사단법인 오픈블록체인 DID협회(이하 OBDIA)의 '스테이블코인 분과'에 정식 가입하고, 스테이블코인 관련 공 …,https://n.news.naver.com/mnews/article/008/0005216041?sid=101
쿠팡, AI 클라우드 서비스 시장 진출한다,쿠팡이 국내 인공지능(AI) 클라우드 서비스 시장에 본격 진출한다고 2일 밝혔다. 그러면서 AI 클라우드 컴퓨팅 서비스를 '쿠팡 …,https://n.news.naver.com/mnews/article/008/0005216040?sid=101
에이전시 욜로, 비트보드와 블록체인 기반 팬덤 비즈니스 혁신 위한 업무협약,광고 에이전시 전문기업인 에이전시 욜로(yolo)가 블록체인 기반 팬덤투표 플랫폼 ㈜사이버딜의 비트보드(bitboard), 비트 …,https://n.news.naver.com/mnews/article/277/0005616699?sid=101
"부산을 세계적 디지털금융 허브로"...제6회 디지털금융포럼 성료,한국정보시스템학회는 2일 해운대 파라다이스호텔 부산 카프리홀에서 디지털화폐, 인공지능(AI) 기반 차세대 디지털 금융을 위한 ' …,https://n.news.naver.com/mnews/article/014/0005371504?sid=101
한국지방재정공제회, 제 20회 CIGAR 국제 컨퍼런스서 대한민국 지방회계 관련 발제 및 정책 간담회 개최,대한민국 지자체 회계정보의 정책 활용방안 발제 OECD와 지속적 협력관계 위한 간담회 개최 한국지방재정공제회(이하 ‘재정공제회’ …,https://n.news.naver.com/mnews/article/009/0005518404?sid=101
'감세' 통과되면 '관세'...트럼프, 日에 불만 표출 [마켓인사이트],사상 최고치를 갈아치우던 뉴욕증시 지난밤에는 대형 기술주를 중심으로 차익실현 움직임이 있었습니다. 지난밤 미국 상원은 도널드 트 …,https://n.news.naver.com/mnews/article/215/0001214863?sid=101
코스피 하락, 원달러 환율 상승,2일 오후 서울 중구 하나은행 딜링룸 전광판에 코스피가 전 거래일 보다 14.59포인트(0.47%) 내린 3075.06포인트를 …,https://n.news.naver.com/mnews/article/003/0013339236?sid=101
소폭 하락한 코스피,2일 오후 서울 중구 하나은행 딜링룸 전광판에 코스피가 전 거래일 보다 14.59포인트(0.47%) 내린 3075.06포인트를 …,https://n.news.naver.com/mnews/article/003/0013339235?sid=101
코스피 내리고 원달러 환율 오르고,2일 오후 서울 중구 하나은행 딜링룸 전광판에 코스피가 전 거래일 보다 14.59포인트(0.47%) 내린 3075.06포인트를 …,https://n.news.naver.com/mnews/article/003/0013339234?sid=101
코스피 소폭 하락, 원달러 환율 소폭 상승,2일 오후 서울 중구 하나은행 딜링룸 전광판에 코스피가 전 거래일 보다 14.59포인트(0.47%) 내린 3075.06포인트를 …,https://n.news.naver.com/mnews/article/003/0013339233?sid=101
코스피 3075.06, 원달러 환율 1359.40, 코스닥 782.17,2일 오후 서울 중구 하나은행 딜링룸 전광판에 코스피가 전 거래일 보다 14.59포인트(0.47%) 내린 3075.06포인트를 …,https://n.news.naver.com/mnews/article/003/0013339232?sid=101
코스피 내리고 원달러 환율 오르고,2일 오후 서울 중구 하나은행 딜링룸 전광판에 코스피가 전 거래일 보다 14.59포인트(0.47%) 내린 3075.06포인트를 …,https://n.news.naver.com/mnews/article/003/0013339231?sid=101
코스피 3075.06 포인트 장 마감,2일 오후 서울 중구 하나은행 딜링룸 전광판에 코스피가 전 거래일 보다 14.59포인트(0.47%) 내린 3075.06포인트를 …,https://n.news.naver.com/mnews/article/003/0013339230?sid=101
전기차 배터리 사용량 증가에도…K배터리 점유율 10%대로 ↓,올해 들어 글로벌 전기차 배터리 사용량은 성장세를 이어갔지만, 국내 배터리 3사(LG에너지솔루션(373220)·삼성SDI(006 …,https://n.news.naver.com/mnews/article/018/0006054826?sid=101
하락세로 마감한 증시,2일 오후 서울 중구 하나은행 딜링룸에 코스피와 코스닥 종가와 환율이 표시되고 있다. 이날 코스피는 전 거래일 대비 14.59P …,https://n.news.naver.com/mnews/article/421/0008346596?sid=101
태광산업 교환사채 발행 중단…트러스톤 가처분 신청에 백기,트러스트자산운용, EB 발행 가처분 소송 태광산업 "노조 등 이해관계자들과 긴밀히 소통" 태광산업이 교환사채(EB) 발행을 중단 …,https://n.news.naver.com/mnews/article/629/0000403866?sid=101
태광산업, 백기 들었다...교환사채 발행 잠정 중단,태광산업이 자사주를 기초로 한 교환사채 발행 절차를 잠정적으로 중단한다. 지난달 30일 비즈워치가 태광산업, 교환사채 성급했나… …,https://n.news.naver.com/mnews/article/648/0000037541?sid=101
美 금리인하 시기 설왕설래...7월 인하 기대감도,파월, 7월 인하설에 “말할 수 없다” FT “조기인하 여지 열어둬” “관세 없었다면 금리 더인하” 트럼프 겨냥 베센트 재무 “ …,https://n.news.naver.com/mnews/article/009/0005518403?sid=101
[속보] 여야, 상법개정안 ‘3%룰’ 보완 처리하기로,여야는 2일 상법 개정안의 일부 쟁점에 합의하기로 했다. 감사위원 선임 시 최대주주의 의결권을 3%로 제한하는 ‘3%룰’과 관련 …,https://n.news.naver.com/mnews/article/029/0002965598?sid=101
경북도, 고수온 등 대비 양식장 관리요령 책자 배부,경북도 어업기술원은 매년 반복되는 고수온 등에 따른 양식 분야 피해를 막기 위해 '자연재해 대비 양식장 관리요령' 책자를 제작, …,https://n.news.naver.com/mnews/article/001/0015483892?sid=101
[속보] 여야, 상법개정안 ‘3%룰’ 보완 처리하기로,여야는 2일 상법 개정안의 일부 쟁점에 합의하기로 했다. 감사위원 선임 시 최대주주의 의결권을 3%로 제한하는 ‘3%룰’과 관련 …,https://n.news.naver.com/mnews/article/029/0002965598?sid=101
경북도, 고수온 등 대비 양식장 관리요령 책자 배부,경북도 어업기술원은 매년 반복되는 고수온 등에 따른 양식 분야 피해를 막기 위해 '자연재해 대비 양식장 관리요령' 책자를 제작, …,https://n.news.naver.com/mnews/article/001/0015483892?sid=101
[체크!해주] "이더리움으로 승부" 1032% 폭등한 BMNR, 리스크는,암호화폐 채굴 및 데이터센터 운영 기업 비트마인 이머전 테크놀로지스(BMNR)가 2거래일 동안 977% 급등했다. 이더리움을 기 …,https://n.news.naver.com/mnews/article/417/0001086903?sid=101
KB국민은행, '포용금융부'·'골든라이프부' 신설…조직개편 단행,KB국민은행이 포용금융 추진을 위한 '포용금융부'와 시니어 고객 특화 조직인 '골든라이프부'를 신설하는 등 조직개편을 실시했다고 …,https://n.news.naver.com/mnews/article/003/0013339228?sid=101
욜로-비트보드, 블록체인 기반 팬덤 비즈니스 혁신 위한 전략적 업무협약 체결,광고에이전시 전문기업 에이전시 욜로(yolo)는 블록체인 기반 팬덤투표 플랫폼 ㈜사이버딜의 비트보드(bitboard), 비트보드 …,https://n.news.naver.com/mnews/article/018/0006054816?sid=101
코스피 외인 '팔자'에 3,070대 하락 마감…코스닥도 내려,코스피가 외국인 순매도세에 3거래일 만에 하락 마감했습니다. 한국거래소에 따르면 오늘(2일) 코스피 종가는 전 거래일 대비 14 …,https://n.news.naver.com/mnews/article/422/0000755459?sid=101
중소기업들, 하반기 경제 ‘호전’ 기대···“내수 회복은 26년 이후에나”,중소기업들 중 올해 하반기에는 매출과 영업이익, 자금 사정 등 경제 여건이 두루 개선될 것으로 보는 곳들이 늘었다. 다만 내수 …,https://n.news.naver.com/mnews/article/032/0003380110?sid=101
컴포즈커피, 업계 최대 규모 가맹점주 교육장 신설,저가 커피 프랜차이즈 브랜드 컴포즈커피가 가맹점주 교육 시스템을 전면 개편하며, 서울 성수동 본사에 업계 최대 규모의 전용 교육 …,https://n.news.naver.com/mnews/article/119/0002974758?sid=101
달러-원 환율, 2.8원 상승…1358.7원에 주간거래 마감,달러-원 환율이 외국인의 국내 주식 순매도 등의 영향으로 상승했습니다. 오늘(2일) 서울 외환시장에서 미국 달러화 대비 원화 환 …,https://n.news.naver.com/mnews/article/374/0000449336?sid=101
농협 지준섭 부회장, 청도 우박 피해현장 방문,지준섭 농협중앙회 부회장(왼쪽에서 세번째)이 12일 우박피해를 입은 경북 청도 각북면의 사과농가를 찾아 농업인을 위로하고 현장상 …,https://n.news.naver.com/mnews/article/022/0004048368?sid=101
방배신삼호 조합장 해임 후 공백⋯재건축 시공사 선정 어떻게?,서울 서초구 방배신삼호아파트 재건축사업이 3기 집행부를 이끌던 조합장이 해임된 후 사업을 추진할 주체의 공백으로 사업이 지연될 …,https://n.news.naver.com/mnews/article/031/0000945302?sid=101
신용점수 올랐네! 금리 내리나?… 뱅크샐러드, 신용관리 서비스 개편,뱅크샐러드가 고객이 대출 금리와 카드 발급 가능성 등 자신의 금융 능력을 확인할 수 있는 새로운 서비스를 개시했다. 뱅크샐러드는 …,https://n.news.naver.com/mnews/article/008/0005216039?sid=101
광주 신가동 재개발 사업 구역 중학교 신설 논란(종합),시교육청 "사업 지연으로 설립 요인 사라져 불가" 조합·주민 "지역사회 기대, 교육 여건 고려해야" 재개발사업이 추진되는 광주 …,https://n.news.naver.com/mnews/article/001/0015483890?sid=101
CJ온스타일 인플루언서 쇼 진행…팬덤 커머스 확장,CJ온스타일에서 진행하는 인플루언서 쇼 이미지. CJ온스타일 제공 CJ온스타일이 인플루언서 16인과 16개의 브랜드를 일 대 일 …,https://n.news.naver.com/mnews/article/021/0002719974?sid=101
알리익스프레스, 월간 사용자 수 900만 명 넘었다,알리익스프레스 로고. 알리익스프레스 제공 알리익스프레스가 6월 기준 월간 사용자 수(MAU) 900만 명을 돌파했다. 2일 리테 …,https://n.news.naver.com/mnews/article/021/0002719973?sid=101
정부, 건전성 경고등 켜진 보험사에 숨통…최종관찰만기 확대일정 조정,금융당국이 최근 재무 건전성 관리 부담이 커진 보험업권의 숨통을 일부 트여주는 조치에 나섰다. 금융위원회와 금융감독원은 지난 1 …,https://n.news.naver.com/mnews/article/032/0003380109?sid=101
부동산 직접 매입 부담없이 안정성과 수익성 동시에…‘동탄·하동 리츠’ 케이프투자증권 2일 청약 시작,부동산을 직접 매입하거나 운영하지 않고도 안정적인 수익을 기대할 수 있는 간접투자 기회가 마련돼 투자자들의 관심이 집중되고 있다 …,https://n.news.naver.com/mnews/article/138/0002199850?sid=101
[강소기업 줌인] ②정진웅 닥터나우 대표 "의료법 개정안, 91% 실수요 배제","이번 개정안대로면 비대면진료를 잘 이용하던 91%의 수혜자들이 모두 배제된다. 이미 6년간 수많은 실사용 데이터가 축적됐음에도 …,https://n.news.naver.com/mnews/article/293/0000069344?sid=101
코스닥 하락 마감,2일 오후 서울 중구 하나은행 딜링룸에 코스피와 코스닥 종가와 환율이 표시되고 있다. 이날 코스피는 전 거래일 대비 14.59P …,https://n.news.naver.com/mnews/article/421/0008346593?sid=101
휴마시스, 주주 김 모 씨 허위사실 유포·무고 형사고소,휴마시스는 주주 김 모 씨에 대해 상습적, 반복적 허위사실 유포에 의한 업무방해와 무고죄에 대한 형사고소를 진행하고 명예훼손에 …,https://n.news.naver.com/mnews/article/003/0013339222?sid=101
휴마시스, 주주 김 모 씨 허위사실 유포·무고 형사고소,휴마시스는 주주 김 모 씨에 대해 상습적, 반복적 허위사실 유포에 의한 업무방해와 무고죄에 대한 형사고소를 진행하고 명예훼손에 …,https://n.news.naver.com/mnews/article/003/0013339222?sid=101
"전기차 배터리 손상, 단독사고가 91%…도로상 물체 충돌 최다",삼성화재 분석…여름철 사고가 전체 30% 차지 전기차 배터리 손상 사고의 대부분은 차량이 단독으로 도로 위 돌출물과 접촉하거나 …,https://n.news.naver.com/mnews/article/001/0015483887?sid=101
코스피 외인 매도 속 3,070대 약세 마감,2일 서울 중구 하나은행 본점 딜링룸 현황판에 코스피 지수가 표시돼 있다. 이날 코스피 지수 종가는 전 거래일 대비 14.59포 …,https://n.news.naver.com/mnews/article/001/0015483883?sid=101
국정기획위 "자율주행 기술 주도권 확보 절실"…현대차 남양연구소 방문,이재명 대통령의 국정 로드맵을 짜는 국정기획위원회가 현대자동차 남양연구소를 찾아 자율주행 기술 현황 파악에 나섰습니다. 국정위 …,https://n.news.naver.com/mnews/article/374/0000449335?sid=101
[헤럴드포토] 미국북서부체리협회, ‘칠이칠이 체리데이’ 행사 진행,사진=미국북서부체리협회 제공 미국북서부체리협회가 2일 오전 서울 종로구 리제로서울에서 미국북서부체리의 출시를 알리는 ‘체리데이’ …,https://n.news.naver.com/mnews/article/016/0002493828?sid=101
한화케미칼 사택 부지 개발…'한화포레나 울산무거' 8월 분양,㈜한화 건설부문의 아파트 브랜드인 '포레나'가 울산에서 첫 분양에 나선다. ㈜한화 건설부문은 울산광역시 남구 무거동 1422번지 …,https://n.news.naver.com/mnews/article/079/0004040790?sid=101
IBK기업은행, 국제금융협회 공식 가입…"국제 정책협력 확대",IBK기업은행이 국제금융협회(IIF)에 정식 가입했다고 2일 밝혔다. 기업은행은 이번 가입을 통해 스테이블코인 등 글로벌 정책 …,https://n.news.naver.com/mnews/article/011/0004504182?sid=101
투자자 예탁금, 증시 랠리에 70조원 돌파… 3년 6개월 만,투자자 예탁금 규모가 70조원을 웃돌았다. 2022년 1월 이후 처음이다. 투자자 예탁금은 투자자가 주식이나 펀드 등 금융투자 …,https://n.news.naver.com/mnews/article/366/0001089368?sid=101
"중증·응급 환자, 우리가 '끝'낸다"…'제2의 개원' 일산백병원의 약속,일산백병원이 지난달 10일 백병원 창립 84주년 기념식에서 '제2의 개원'을 선포했다. 설계 단계부터 6년여에 걸친 대규모 증축 …,https://n.news.naver.com/mnews/article/008/0005216036?sid=101
하락세로 마감한 코스피,2일 오후 서울 중구 하나은행 딜링룸에 코스피와 코스닥 종가와 환율이 표시되고 있다. 이날 코스피는 전 거래일 대비 14.59P …,https://n.news.naver.com/mnews/article/421/0008346584?sid=101
코스피 하락 마감,2일 오후 서울 중구 하나은행 딜링룸에 코스피와 코스닥 종가와 환율이 표시되고 있다. 이날 코스피는 전 거래일 대비 14.59P …,https://n.news.naver.com/mnews/article/421/0008346583?sid=101
하락세로 마감한 코스피·코스닥,2일 오후 서울 중구 하나은행 딜링룸에 코스피와 코스닥 종가와 환율이 표시되고 있다. 이날 코스피는 전 거래일 대비 14.59P …,https://n.news.naver.com/mnews/article/421/0008346582?sid=101
코스피·코스닥 하락세로 마감,2일 오후 서울 중구 하나은행 딜링룸에 코스피와 코스닥 종가와 환율이 표시되고 있다. 이날 코스피는 전 거래일 대비 14.59P …,https://n.news.naver.com/mnews/article/421/0008346581?sid=101
코스피 하락, 원달러 상승,2일 오후 서울 중구 하나은행 딜링룸에 코스피와 코스닥 종가와 환율이 표시되고 있다. 이날 코스피는 전 거래일 대비 14.59P …,https://n.news.naver.com/mnews/article/421/0008346580?sid=101
코스피 외인 매도 속 3,070대 약세 마감,2일 서울 중구 하나은행 본점 딜링룸 현황판에 코스피 지수가 표시돼 있다. 이날 코스피 지수 종가는 전 거래일 대비 14.59포 …,https://n.news.naver.com/mnews/article/001/0015483881?sid=101
英, '해상풍력 공급망 컨퍼런스 전시회' 참가,주한영국대사관이 2~3일 부산 벡스코에서 열리는 '2025 해상풍력 공급망 컨퍼런스 전시회'에 영국 해상풍력 기업 8곳 참여하는 …,https://n.news.naver.com/mnews/article/008/0005216035?sid=101
코스피 외인 매도 속 3,070대 약세 마감,2일 서울 중구 하나은행 본점 딜링룸 현황판에 코스피 지수가 표시돼 있다. 이날 코스피 지수 종가는 전 거래일 대비 14.59포 …,https://n.news.naver.com/mnews/article/001/0015483880?sid=101
코스피 외인 매도 속 3,070대 약세 마감,2일 서울 중구 하나은행 본점 딜링룸 현황판에 코스피 지수가 표시돼 있다. 이날 코스피 지수 종가는 전 거래일 대비 14.59포 …,https://n.news.naver.com/mnews/article/001/0015483879?sid=101
민주노총 "오는 16·19일 총파업…노란봉투법 추진·안전운임제 복원",전국민주노동조합총연맹이 '노란봉투법' 재추진과 화물기사 안전운임제 복원 등을 주장하며 오는 16일과 19일 이틀간 총파업을 예고 …,https://n.news.naver.com/mnews/article/374/0000449333?sid=101
Lunit, Microsoft to Co-Develop Medical AI in First Big Tech Partnership,Seo Beom-seok, CEO of Lunit.(Photo by Lunit) Lunit, a medical AI compan …,https://n.news.naver.com/mnews/article/018/0006054811?sid=101
삼성바이오에피스·보령, 골질환 치료제 '엑스브릭' 국내 판매 맞손,삼성바이오에피스는 보령과 골질환 치료제 '엑스지바' 바이오시밀러(바이오의약품 복제약) '엑스브릭' 국내 판매를 위한 파트너십 계 …,https://n.news.naver.com/mnews/article/374/0000449332?sid=101
코스피 외인 매도 속 3,070대 약세 마감,2일 서울 중구 하나은행 본점 딜링룸 현황판에 코스피 지수가 표시돼 있다. 이날 코스피 지수 종가는 전 거래일 대비 14.59포 …,https://n.news.naver.com/mnews/article/001/0015483877?sid=101
코스피 외인 매도 속 3,070대 약세 마감,2일 서울 중구 하나은행 본점 딜링룸 현황판에 코스피 지수가 표시돼 있다. 이날 코스피 지수 종가는 전 거래일 대비 14.59포 …,https://n.news.naver.com/mnews/article/001/0015483876?sid=101
[포토] 대화하는 송언석-안철수,송언석 국민의힘 비대위원장(오른쪽)과 안철수 혁신위원장이 2일 국회 국민의힘 원내대표실에서 만나 대화하고 있다.,https://n.news.naver.com/mnews/article/277/0005616691?sid=101
ETF 200조 시장 만든 개미, 상반기 11.8조 사들였다,국내 ETF(상장지수펀드) 시장 순자산이 210조원을 넘어서며 사상 최대치를 기록한 가운데, 올해 상반기 개인투자자가 ETF를 …,https://n.news.naver.com/mnews/article/008/0005216034?sid=101
SSG닷컴, 제로베이스원 데뷔 2주년 기념 ‘케이크·쿠키세트’ 선봬,SSG닷컴은 아이돌 그룹 ‘제로베이스원’ 데뷔 2주년을 기념한 한정판 디저트 2종을 오는 4일부터 단독 판매한다고 2일 밝혔다. …,https://n.news.naver.com/mnews/article/029/0002965596?sid=101
강남 한복판 미래차 연구소…현대차·기아 'UX 스튜디오' 개관,현대자동차·기아는 3일 현대자동차 강남대로 사옥에 ‘UX 스튜디오 서울’을 개관했다. 이곳은 고객들의 미래 모빌리티 경험을 토대 …,https://n.news.naver.com/mnews/article/448/0000539497?sid=101
최태원 SK 회장 장남, 컨설팅 회사로 이직…경영수업 본격화,최태원 SK그룹 회장의 장남 최인근 씨가 최근 SK이노베이션E&S(SKI E&S)를 퇴사하고 맥킨지앤드컴퍼니 이직했다. 그간 국 …,https://n.news.naver.com/mnews/article/030/0003327671?sid=101
“오타니가 한국에?” 일본 야구 팬들의 성지로 떠오른 ‘이곳’,오타니 쇼헤이. AFP 연합뉴스 경기도 고양시에 위치한 지하철 3호선 대곡역이 최근 일본인 관광객들 사이에서 ‘핫플레이스’로 떠 …,https://n.news.naver.com/mnews/article/021/0002719971?sid=101
[포토뉴스]강원조달청, 강릉시 차세대 나라장터 사용자 교육 지원,강원조달청(청장:이경원)은 2일 강릉시청 대회의실에서 강릉시 구매 및 사업 담당자 100여명을 대상으로 차세대 나라장터 사용자 …,https://n.news.naver.com/mnews/article/087/0001127045?sid=101
