[혁신플랫폼톡]거브테크, 민관이 함께 여는 공공혁신의 미래,세계경제포럼(The World Economic Forum)이 1월 발표한 보고서에 따르면, 글로벌 거브테크(GovTech) 시장 …,https://n.news.naver.com/mnews/article/030/0003327687?sid=101
상반기 낙제점 '편의점', 카테고리 확장 위해 대형 매장 출점 늘린다,국내 편의점 업계가 상반기 주춤했던 실적을 극복하기 위해 승부수를 꺼낸다. 편의점 포화 상태로 인한 정체기라는 평가가 나오고 있 …,https://n.news.naver.com/mnews/article/030/0003327681?sid=101
[ET시론] AI 인재 전쟁, 이제 대학의 시간이다.,4차 산업혁명 시대, 인공지능(AI)·빅데이터·디지털 트윈 등 첨단 기술이 전방위적으로 확산되면서 디지털 인재에 대한 수요가 폭 …,https://n.news.naver.com/mnews/article/030/0003327679?sid=101
[마켓뷰] 관세 불안 재점화에 코스피, 3070선 후퇴… 외인 다시 ‘팔자’,美트럼프발 관세 불안 재점화 코스피지수 0.24% 하락 마감 급등 종목 중심 차익실현 매물 출회 코스닥지수 0.19% 소폭 하락 …,https://n.news.naver.com/mnews/article/366/0001089377?sid=101
건전성 적색등 켜진 보험업계… 당국, 할인율 현실화 속도 조절,보험업계 건전성 관리에 적신호가 켜지면서 금융당국이 대응 방안 마련에 나섰다. 예정된 보험부채 평가 할인율 현실화 방침에 속도를 …,https://n.news.naver.com/mnews/article/469/0000873808?sid=101
공정위, ‘배전반 교체공사 입찰 담합’ 효성·LS에 과징금,과징금 1.5억 원 부과 공정거래위원회는 ‘발전소 배전반 판넬 교체공사 입찰’ 관련 담합 혐의로 효성과 LS 두 회사에 총 1억 …,https://n.news.naver.com/mnews/article/021/0002719984?sid=101
코람코자산신탁, 홍대입구역 코앞 ‘케이스퀘어 홍대’ 매각 추진,2016년 매입 후 약 9년 만 매각가 4000억원대 예상 이 기사는 2025년 7월 2일 14시 26분 조선비즈 머니무브(MM …,https://n.news.naver.com/mnews/article/366/0001089376?sid=101
GS그룹, AI 기술 협력의 장 열었다...'GenAI Connect Day',GS그룹이 1일 서울 강남구 GS타워에서 '제3회 GS GenAI 커넥트 데이'를 열었다고 2일 밝혔다. 이번 행사는 'AI 에 …,https://n.news.naver.com/mnews/article/469/0000873807?sid=101
첨단연구장비 국산화 박차…산학연 드림팀 ‘얼라이언스’ 출범,과기정통부, 첨단혁신장비 얼라이언스 출범식. 연합뉴스 첨단 연구 장비 국산화 생태계 구축을 위해 장비 수요자와 공급자 등 산업계 …,https://n.news.naver.com/mnews/article/021/0002719983?sid=101
[속보] 여야, '3%룰' 포함 상법 개정안 처리 합의,여야, '3%룰' 포함 상법 개정안 처리 합의,https://n.news.naver.com/mnews/article/374/0000449338?sid=101
인생 2막 향한 중장년의 힘찬 발걸음…‘베이비부머 인턴(人-Turn)캠프’ 입학식 성료,대한민국 경제 성장 주역 ‘베이비부머’ 세대들의 새로운 도전을 응원하는 행사가 열렸다. 경기도는 2일 경기 수원시 경기아트센터에 …,https://n.news.naver.com/mnews/article/011/0004504187?sid=101
[단독] ‘에이피알’ 김병훈, 290억에 아크로서울포레스트 펜트하우스 샀다... 매도자는 DL 이해성,전국 아파트 역대 최고 평당 매매가 매도인은 범 DL가 이해성 대림디앤아이 대표 이 기사는 2025년 7월 2일 15시 04분 …,https://n.news.naver.com/mnews/article/366/0001089375?sid=101
“방 꼭 비울 필요 없어요”...삼성, 8시간만에 에어컨 설치도 ‘뚝딱’,무더위 속 시스템 에어컨 잘 팔려 리모델링 확대에 수요 더 늘어날듯 가전업계, AI 기능 강화해 시장 공략 평년을 웃도는 덥고 …,https://n.news.naver.com/mnews/article/009/0005518414?sid=101
쿠팡, AI 클라우드 컴퓨팅 서비스 ‘CIC’로 리브랜딩,쿠팡이 인공지능(AI) 클라우드 컴퓨팅 서비스를 새롭게 시작합니다. 쿠팡은 오늘(2일) AI 클라우드 컴퓨팅 서비스의 브랜드를 …,https://n.news.naver.com/mnews/article/449/0000313594?sid=101
인사말 하는 정태호 국정기획위 경제 1분과장,정태호 국정기획위원회 경제 1분과장이 2일 경기 화성시 현대차그룹 남양연구소를 방문해 인사말을 하고 있다. (사진=국정기획위원회 …,https://n.news.naver.com/mnews/article/003/0013339277?sid=101
국정기획위원회, 현대차그룹 남양연구소 방문,정태호 국정기획위원회 경제 1분과장과 이정헌 경제 2분과 소위원장 등이 2일 경기 화성시 현대차그룹 남양연구소를 방문해 전시물을 …,https://n.news.naver.com/mnews/article/003/0013339276?sid=101
국정기획위원회, 현대차그룹 남양연구소 방문,정태호 국정기획위원회 경제 1분과장 등이 2일 경기 화성시 현대차그룹 남양연구소를 방문해 기념촬영 하고 있다. (사진=국정기획위 …,https://n.news.naver.com/mnews/article/003/0013339275?sid=101
국정기획위원회 경제 1분과, 현대차그룹 남양연구소 방문,정태호 국정기획위원회 경제 1분과장이 2일 경기 화성시 현대차그룹 남양연구소를 방문해 전시물을 관람하고 있다. (사진=국정기획위 …,https://n.news.naver.com/mnews/article/003/0013339274?sid=101
국정기획위원회, 현대차그룹 남양연구소 방문,정태호 국정기획위원회 경제 1분과장 등이 2일 경기 화성시 현대차그룹 남양연구소를 방문해 로봇개를 살펴보고 있다. (사진=국정기 …,https://n.news.naver.com/mnews/article/003/0013339273?sid=101
국정기획위원회, 현대차그룹 남양연구소 방문,정태호 국정기획위원회 경제 1분과장이 2일 경기 화성시 현대차그룹 남양연구소를 방문해 방명록을 작성하고 있다. (사진=국정기획위 …,https://n.news.naver.com/mnews/article/003/0013339272?sid=101
Gold trading soars to all-time high in first half of 2025 as investors seek safe-haven assets,Gold trading on the Korea Exchange (KRX) soared to an all-time high in …,https://n.news.naver.com/mnews/article/640/0000072808?sid=101
파라다이스시티, 신라면세점과 외국인 관광객 유치 맞손,파라다이스시티는 최근 인천 중구 파라다이스시티에서 신라면세점과 외국인 관광객 유치 활성화를 위한 업무협약을 했다고 2일 밝혔다. …,https://n.news.naver.com/mnews/article/666/0000077222?sid=101
대방건설, 전속 모델 한효주 '디에트르' 화보 공개,대방건설은 배우 한효주가 자사 주거 브랜드 '디에트르(D’être)'의 지면 화보촬영을 진행했다고 2일 밝혔다. 지난 …,https://n.news.naver.com/mnews/article/003/0013339268?sid=101
2일 테슬라 2분기 인도량 공개, 주가 더 떨어질 수도,1일(현지시간) 일론 머스크 테슬라 최고경영자(CEO)와 도널드 트럼프 미국 대통령이 정면충돌, 테슬라 주가가 5% 이상 급락한 …,https://n.news.naver.com/mnews/article/421/0008346635?sid=101
'장기일반민간임대' 인기에 관저 푸르지오 센트럴파크 관심,최근 부동산 시장에서 장기일반민간임대주택에 대한 관심이 높아지고 있다. 치솟는 분양가와 전세사기 등 시장 불안정성이 계속되면서, …,https://n.news.naver.com/mnews/article/277/0005616710?sid=101
에티포스, 150억원 시리즈B 투자유치…글로벌 생산거점 및 시장 공략,차량대사물통신(V2X) 반도체 전문기업 에티포스가 150억원 규모의 시리즈B 투자유치에 나선다. 2일 에티포스는 LB인베스트먼트 …,https://n.news.naver.com/mnews/article/008/0005216050?sid=101
[그래픽] 추경 예비심사서 증액된 주요 사업,정부가 경기 활성화와 소비 진작을 위해 총 30조5천억원 규모로 편성한 추가경정예산안이 국회 상임위원회 예비 심사 과정에서 속속 …,https://n.news.naver.com/mnews/article/001/0015483940?sid=101
국정기획위원회, 현대차 남양연구소 방문,대통령 직속 국정기획위원회 정태호 경제 1분과장 등이 2일 경기도 화성시 현대자동차그룹 남양연구소를 방문했다. 정태호 1분과장이 …,https://n.news.naver.com/mnews/article/001/0015483935?sid=101
신한 출신으로 물갈이?… 성대규 동양생명 대표, 1차인선 75% 완료,성대규 동양생명 대표가 이달 2일 CIO(최고운용책임자), CFO(최고재무책임자)를 선임하면서 1기 체제 인선 작업을 75% 마 …,https://n.news.naver.com/mnews/article/417/0001086911?sid=101
관저 푸르지오 센트럴파크 '장기일반민간임대' 공급 예고에 관심,최근 부동산 시장에서 장기일반민간임대주택에 대한 관심이 높아지고 있다. 치솟는 분양가와 전세사기 등 시장 불안정성이 계속되면서, …,https://n.news.naver.com/mnews/article/011/0004504186?sid=101
국정기획위원회, 현대차 남양연구소 방문,대통령 직속 국정기획위원회 정태호 경제 1분과장 등이 2일 경기도 화성시 현대자동차그룹 남양연구소를 방문했다. 정태호 분과장 등 …,https://n.news.naver.com/mnews/article/001/0015483933?sid=101
국정기획위원회, 현대차 남양연구소 방문,대통령 직속 국정기획위원회 정태호 경제 1분과장 등이 2일 경기도 화성시 현대자동차그룹 남양연구소를 방문했다. 정태호 분과장 등 …,https://n.news.naver.com/mnews/article/001/0015483932?sid=101
현대차·기아, 상반기 美 판매량 89만3152대 ‘역대 최다’,현대자동차의 대형 SUV ‘디 올 뉴 팰리세이드(신형 팰리세이드)’ . 현대차 제공. 현대자동차·기아가 미국에서 상반기 기준으로 …,https://n.news.naver.com/mnews/article/021/0002719981?sid=101
이즈피엠피, 넥스트라이즈 2025서 오투미트·리드엑스로 밋업 혁신 실현,마이스(MICE)·관광산업 디지털전환 선도기업 이즈피엠피(대표 한신자, 최학찬)가 ‘넥스트라이즈 2025, 서울’에서 자사의 마 …,https://n.news.naver.com/mnews/article/011/0004504185?sid=101
국내 ‘AI 정수장 운영 기술’, ISO 국제표준 작업초안으로 채택,글로벌 AI 물산업 주도, AI 3대 강국 국가전략 실현 기대감↑ 6월 23일(현지시간)부터 27일까지 캐나다 토론토에서 열린 …,https://n.news.naver.com/mnews/article/016/0002493831?sid=101
국정기획위원회, 현대차 남양연구소 방문,대통령 직속 국정기획위원회 정태호 경제 1분과장 등이 2일 경기도 화성시 현대자동차그룹 남양연구소를 방문했다. 정태호 분과장이 …,https://n.news.naver.com/mnews/article/001/0015483931?sid=101
[속보] 여야, '3%룰' 포함 상법 개정안 처리 합의,여야, '3%룰' 포함 상법 개정안 처리 합의,https://n.news.naver.com/mnews/article/243/0000080573?sid=101
[통장잔GO] 대출금리 한 자릿수로 낮춰주는 은행은 어디?,신한금융그룹은 이달 중 신한은행 가계대출 보유 고객의 금융부담 완화를 위해 금리가 두 자릿수 이상인 모든 기존 가계대출의 금리를 …,https://n.news.naver.com/mnews/article/119/0002974763?sid=101
"테이블오더 수수료 부담 던다" 카카오페이, QR결제 생태계 구축,카카오페이 신원근 대표, 카카오 황준연 성과 리더, 한국정보통신 박진순 본부장, NICE정보통신 김승현 대표, KIS정보통신 조 …,https://n.news.naver.com/mnews/article/018/0006054854?sid=101
부산관광공사, 제1회 ESG·녹색경영위원회 개최,부산관광공사는 지난 30일 민·관·학 전문가들과 함께 ‘제1회 ESG·녹색경영위원회’를 개최했다고 2일 밝혔다. 회의에는 김해창 …,https://n.news.naver.com/mnews/article/005/0001787098?sid=101
국정기획위원회, 현대차 남양연구소 방문,대통령 직속 국정기획위원회 정태호 경제 1분과장 등이 2일 경기도 화성시 현대자동차그룹 남양연구소를 방문했다. 정태호 분과장 등 …,https://n.news.naver.com/mnews/article/001/0015483930?sid=101
오성환 당진시장 "현대제철, 자사고·종합병원 반드시 설립해야","MOU라 구속력 없어…약속 지키도록 시민들이 힘 모아 달라" 현대제철이 충남 당진에 자율형사립고와 종합병원을 설립하기로 충남도 …,https://n.news.naver.com/mnews/article/001/0015483929?sid=101
국정기획위원회, 현대차 남양연구소 방문,대통령 직속 국정기획위원회 정태호 경제 1분과장 등이 2일 경기도 화성시 현대자동차그룹 남양연구소를 방문했다. 정태호 분과장 등 …,https://n.news.naver.com/mnews/article/001/0015483928?sid=101
정부 R&D 투자, '국가 총지출 5% 이상 의무화' 추진,국정기획위원회가 정부의 연구개발(R&D) 투자가 국가 총지출의 5% 이상이 되도록 하는 의무 조항을 신설하겠다고 밝혔다. 국정기 …,https://n.news.naver.com/mnews/article/448/0000539505?sid=101
오스코텍, KB증권·미래에셋 출신 신동준 신임 CFO 선임… “경영전문성·투명성 강화”,국내 바이오텍 오스코텍은 전 KB증권 리서치센터장·투자전략본부장을 역임한 신동준 전무를 최고재무책임자(CFO, Chief Fin …,https://n.news.naver.com/mnews/article/020/0003645293?sid=101
한국표준협회, '제10회 서비스위크' 개막···AX 서비스 혁신 방향 제시,한국표준협회는 2일 롯데호텔 서울에서 국내·외 기업 및 학계 전문가들과 함께 서비스산업 미래와 전략을 논의하는 '제10회 서비스 …,https://n.news.naver.com/mnews/article/030/0003327674?sid=101
‘불장’에 증권사도 웃는다…거래대금 증가 힘입어 실적 개선 기대,올해 2분기 국내 주요 증권사들의 영업이익이 소폭 증가할 것으로 예상된다. 대선 이후 증시 거래대금이 크게 늘고, 주식시장 반등 …,https://n.news.naver.com/mnews/article/029/0002965601?sid=101
관세 우려에 한국·일본 증시 하락,2일 서울 중구 하나은행 본점 딜링룸 현황판에 코스피와 일본 닛케이지수가 표시돼 있다. 트럼프 미국 대통령이 일본에 대한 상호관 …,https://n.news.naver.com/mnews/article/001/0015483922?sid=101
동대문 장안동 134-15 신통기획 확정…1,750가구 조성,서울시는 2일 장안동 134-15 일대 신속통합기획을 확정했다고 밝혔다. 이로써 그동안 정체돼 있던 장안동 일대의 주거환경 개선 …,https://n.news.naver.com/mnews/article/215/0001214866?sid=101
구글 "AI는 창작자에게 영감을 주는 협업파트너",김민석 기자 "인공지능(AI) 모델은 혼자서 음악을 원하지 않습니다. 여러 예술인과 구글과 협업 사례로 볼 수 있듯 AI는 창작 …,https://n.news.naver.com/mnews/article/421/0008346630?sid=101
美반도체 세액공제 25→35% 확대…삼성·SK하닉 긍정적,미국 상원이 1일(현지시간) 미국 반도체 공장 건설에 대한 세액공제를 기존 25%에서 35%로 확대했다. 현지 투자를 진행 중인 …,https://n.news.naver.com/mnews/article/003/0013339263?sid=101
내년 최저시급 1만1260원?···소상공인들 "벼랑 끝으로 내몰고 있다",소상공인연합회는 노동계가 주장하는 내년도 최저시급 1만1260원에 대해 강력한 유감을 표했다. 송치영 소상공인연합회 회장은 2일 …,https://n.news.naver.com/mnews/article/050/0000093112?sid=101
완성차 업계 "내수 부진, 파격 프로모션으로 뚫는다",국내 완성차 업계가 내수 부진을 타개하기 위해 가격 인하, 초저금리 지원 등을 골자로 한 프로모션을 대대적으로 시행하고 있다. …,https://n.news.naver.com/mnews/article/018/0006054850?sid=101
유한건강생활, 중국 국영기업 COFCO 자회사와 건강기능식품 단독 개발 및 수출 계약 체결,헬스&라이프스타일 전문기업 유한건강생활(대표 손정수)이 중국 최대 국영 식품기업이자 포춘 글로벌 500대 기업인 COFCO의 자 …,https://n.news.naver.com/mnews/article/050/0000093111?sid=101
트럼프 관세 발언에 증시 ‘스트레스’…코스피, 3075선 마감,전일 연고점을 경신했던 코스피 지수가 2일 3030선까지 밀리며 하락 전환했다. 최근 빨라진 업종별 순환매 흐름에 단기 변동성이 …,https://n.news.naver.com/mnews/article/018/0006054849?sid=101
수원시, 탑동 이노베이션밸리 토지공급계획’ 승인…경제자유구역 향해 한걸음,수원시가 ‘탑동 이노베이션밸리 토지공급계획’을 승인했다. 수원시는 2일 수원도시공사가 신청한 실시계획 변경인가를 6월 30일에 …,https://n.news.naver.com/mnews/article/009/0005518411?sid=101
"농업인 온열질환 피해 없도록…한낮 작업 자제하고 수분 충분 섭취",농촌진흥청은 폭염으로 인한 농업인 온열질환 피해를 예방하기 위해 한낮 작업을 자제하고 수분을 충분히 섭취하는 등 '건강 안전 행 …,https://n.news.naver.com/mnews/article/003/0013339262?sid=101
대방건설, 전속 모델 한효주 '디에트르 화보·메이킹 필름' 공개,대방건설은 최근 배우 한효주가 자사 주거 브랜드인 '디에트르(D’être)'의 지면 화보를 찍었다고 2일 밝혔다. 이번 …,https://n.news.naver.com/mnews/article/421/0008346625?sid=101
코스피, 상호관세 유예 만료 앞두고 '숨고르기'…외인 '팔자',코스피지수가 상호관세 리스크 재부각에 투자심리가 위축되며 숨고르기에 들어갔다. 2일 코스피지수는 전일 대비 0.47% 내린 30 …,https://n.news.naver.com/mnews/article/015/0005152602?sid=101
한국공항, 관세청 AEO 공인 ‘AA등급’ 재인증,한진그룹 계열 한국공항은 관세청이 주관하는 AEO(수출입안전관리우수업체 ) 공인 갱신 심사에서 ‘AA’등급을 재인증 받았다고 2 …,https://n.news.naver.com/mnews/article/018/0006054848?sid=101
[속보] 여야, '3%룰' 포함 상법 개정안 처리 합의,,https://n.news.naver.com/mnews/article/050/0000093110?sid=101
최근 1년간 서울 아파트 착공 2만729채…10.3% 감소,최근 1년간 서울에서 착공한 아파트가 전년 대비 10% 넘게 줄어든 것으로 나타났다. 2일 부동산 리서치업체 리얼투데이가 국토교 …,https://n.news.naver.com/mnews/article/020/0003645292?sid=101
소상공인연합회장 “노동계 주장 최저임금 11,260원, 강력한 유감”,노동계가 어제(1일) 최저임금 수정 요구안으로 1만1천260원을 제시한 데 대해, 소상공인연합회가 담화문을 내고 반발했습니다. …,https://n.news.naver.com/mnews/article/056/0011981239?sid=101
HS효성첨단소재, '순환경제 페스티벌' 참가…친환경 소재 선봬,HS효성첨단소재가 '순환 경제'를 주제로 한 전시회에 참가해 친환경·재활용 소재와 리사이클 기술을 선보인다. HS효성첨단소재가 …,https://n.news.naver.com/mnews/article/277/0005616706?sid=101
해진공, 해양수도 부산에 '미래인재의 꿈' 싣는 '해양드림독 2호' 개소,한국해양진흥공사(사장 안병길, 이하 해진공)는 지난 1일 부산 북구에 위치한 장선종합사회복지관에서 지역 아동·청소년을 위한 해양 …,https://n.news.naver.com/mnews/article/082/0001333507?sid=101
카드론도 '신용대출' 간주…'연소득 이내' 한도에 포함,금융위, 여신협회 질의에 답변…현금서비스는 제외 앞으로는 카드론(장기카드대출)도 신용대출에 포함돼 한도가 '연 소득 이내'로 제 …,https://n.news.naver.com/mnews/article/629/0000403873?sid=101
코웨이, 서울 삼일초에 '청정학교 교실숲 제7호' 조성,공기정화식물 494그루 전달…환경 교육도 진행 코웨이는 서울 동작구 삼일초등학교에 '코웨이 청정학교 교실숲 제7호'를 조성했다고 …,https://n.news.naver.com/mnews/article/629/0000403871?sid=101
포포즈, 반려동물 친환경 장례 ‘자연닮음’ 선보여,반려동물 장례 전문 브랜드 포포즈(FOUR PAWS)가 환경에 미치는 영향을 줄이고 생명의 순환 가치를 담은 신규 장례 구성 ‘ …,https://n.news.naver.com/mnews/article/020/0003645291?sid=101
[픽! 시니어금융]② KB, 퇴직연금 42.7조 적립…13년차 '골든라이프' 위상,KB금융그룹의 시니어 특화 브랜드 'KB골든라이프'가 출범 13년을 맞이했다. 은퇴와 노후설계 중심의 금융서비스에서 시니어 고객 …,https://n.news.naver.com/mnews/article/293/0000069347?sid=101
관세 우려에 한국·일본 증시 하락,2일 서울 중구 하나은행 본점 딜링룸 현황판에 코스피와 일본 닛케이지수가 표시돼 있다. 트럼프 미국 대통령이 일본에 대한 상호관 …,https://n.news.naver.com/mnews/article/001/0015483915?sid=101
수주 바람 한껏…풍력주, 부활 신호탄 쏘나?,정부가 친환경 에너지를 강화하려는 움직임을 보이자 풍력주에 대한 시장 관심이 살아나고 있다. 2일 거래소에서 해상풍력 하부구조물 …,https://n.news.naver.com/mnews/article/008/0005216044?sid=101
정부, 4.7조 NXC 주식 매각절차 개시…원매자 텐센트 등 거론,정부가 넥슨 창업자 고(故) 김정주 회장 유가족이 상속세로 물납한 넥슨 지주사 NXC 지분 매각을 개시했다. 2일 기획재정부에 …,https://n.news.naver.com/mnews/article/421/0008346616?sid=101
HMM, 스페인 알헤시라스 터미널 확장…2028년까지 210만TEU로,HMM이 현재 운영하고 있는 스페인 알헤시라스 컨테이너 터미널(TTIA)을 확장 개발한다고 2일 밝혔다. HMM은 TTIA를 통 …,https://n.news.naver.com/mnews/article/029/0002965600?sid=101
발언하는 마니쉬 굽타 구글 딥마인드 시니어디렉터,마니쉬 굽타 구글 딥마인드 시니어 디렉터가 2일 오후 서울 강남구 조선팰리스에서 열린 '구글 FOR KOREA'에서 축사하고 있 …,https://n.news.naver.com/mnews/article/421/0008346614?sid=101
축사하는 마니쉬 굽타 구글 딥마인드 시니어디렉터,마니쉬 굽타 구글 딥마인드 시니어 디렉터가 2일 오후 서울 강남구 조선팰리스에서 열린 '구글 FOR KOREA'에서 축사하고 있 …,https://n.news.naver.com/mnews/article/421/0008346613?sid=101
네이버노조, 국민연금에 임시주총 요구…최인혁 대표 사퇴 압박,네이버 노조가 최인혁 테크비즈니스 부문 대표의 사퇴를 압박하기 위해 네이버 최대 주주인 국민연금에 임시 주주총회 소집을 요구하기 …,https://n.news.naver.com/mnews/article/028/0002753955?sid=101
서울 장안동, 신통기획으로 개발 본궤도[집슐랭],서울 동대문구 장안동에 1750가구 규모의 주거 대단지가 들어선다. 서울시는 2일 장안동 134-15 일대 신속통합기획(신통기획 …,https://n.news.naver.com/mnews/article/011/0004504183?sid=101
숨 고른 韓증시…코스피 3070대 약보합 마감,코스피와 코스닥 모두 약보합세로 장을 마쳤다. 단기간 급등 이후 숨을 고르는 모양새다. 2일 코스피는 전날 대비 0.47% 떨어 …,https://n.news.naver.com/mnews/article/277/0005616704?sid=101
"국가총지출 5% 이상 R&D 투자" 국정委 1호 법안 발의,국정기획위원회가 국가 연구개발(R&D) 예산 체계를 개편하는 내용의 법안을 마련했다. 국가과학기술자문회의 심의 의결 기한을 연장 …,https://n.news.naver.com/mnews/article/003/0013339242?sid=101
고양시, 기재부에 '인천2호선 고양 연장사업' 조속 확정 촉구,경기 고양시는 기획재정부와 한국개발연구원(KDI)에 인천2호선 고양 연장사업 예비타당성조사 결과를 조속히 확정해 줄 것을 강력히 …,https://n.news.naver.com/mnews/article/001/0015483911?sid=101
고양시, 기재부에 '인천2호선 고양 연장사업' 조속 확정 촉구,경기 고양시는 기획재정부와 한국개발연구원(KDI)에 인천2호선 고양 연장사업 예비타당성조사 결과를 조속히 확정해 줄 것을 강력히 …,https://n.news.naver.com/mnews/article/001/0015483911?sid=101
6월 소비자 물가 2.2% 올라...라면 7%↑,라면 1개가 2천 원이라고 놀라며 정부는 물가 잡기에 총력을 쏟겠다고 했지만 밥상 물가는 계속 오르고 있습니다. 물가 상승에 가 …,https://n.news.naver.com/mnews/article/215/0001214865?sid=101
토스증권, 서울시와 중장년층 대상 금융교육 프로그램 마쳐,토스증권이 지난달 25일 중장년층을 위한 맞춤형 금융교육 프로그램을 성황리에 개최했다고 2일 밝혔다. 서울특별시 평생교육진흥원과 …,https://n.news.naver.com/mnews/article/417/0001086908?sid=101
美관세 불확실성 지속…코스피, 연고점 경신 하루 만에 약세 전환[시황종합],미국의 관세 불확실성에 코스피가 연고점 경신 하루 만에 하락 마감했다. 코스피는 전일 대비 14.59p(-0.47%) 하락한 3 …,https://n.news.naver.com/mnews/article/421/0008346607?sid=101
관세 우려에 한국·일본 증시 하락,2일 서울 중구 하나은행 본점 딜링룸 현황판에 코스피와 일본 닛케이지수가 표시돼 있다. 트럼프 미국 대통령이 일본에 대한 상호관 …,https://n.news.naver.com/mnews/article/001/0015483910?sid=101
